{
  "schema_version": 1,
  "comptes_x": [
    "@karpathy",
    "@DanielMiessler",
    "@AnthropicAI",
    "@OpenAI",
    "@GoogleDeepMind",
    "@sama",
    "@MistralAI",
    "@swyx",
    "@simonw",
    "@cernbasher",
    "@ylecun",
    "@GaryMarcus",
    "@benedictevans",
    "@mollyfmatt",
    "@GergelyOrosz",
    "@kelseyhightower",
    "@martinfowler",
    "@shreyas",
    "@ethanmollick",
    "@jeremyphoward",
    "@fchollet",
    "@goodside",
    "@joulee",
    "@lethain",
    "@skamille",
    "@WholeMarsBlog",
    "@Teslaconomics",
    "@SawyerMerritt",
    "@SpaceX",
    "@nasaspaceflight",
    "@davidasinclair",
    "@PeterAttiaMD",
    "@hubermanlab",
    "@EricTopol",
    "@RogerSeheult",
    "@CleoAbram",
    "@JDeQuebec",
    "@CBCAlerts",
    "@LeDevoir",
    "@technationca",
    "@creativedestruc",
    "@DiaryOfACEO",
    "@TomBilyeu",
    "@naval",
    "@ShaneAParrish",
    "@ttunguz",
    "@JasonLemkin",
    "@lesaffaires",
    "@bnnbloomberg",
    "@FT",
    "@WSJ",
    "@briankrebs",
    "@troyhunt",
    "@EUAIOffice",
    "@IAPP_updates",
    "@AlgorithmWatch",
    "@EUdigitalActs",
    "@fortelabs",
    "@david_perell",
    "@tferriss",
    "@dhh"
  ],
  "recherches_thematiques": [
    {"theme": "AI", "query": "AI LLM Claude GPT Gemini Grok Mistral model release agent coding", "section_id": "ai-tech"},
    {"theme": "AI Enterprise", "query": "enterprise AI adoption implementation ROI CIO digital transformation", "section_id": "ai-tech"},
    {"theme": "Tesla", "query": "Tesla FSD robotaxi Optimus Cybertruck energy", "section_id": "tesla"},
    {"theme": "SpaceX", "query": "SpaceX Starship Starlink launch", "section_id": "spacex"},
    {"theme": "Santé", "query": "longevity fasting intermittent menopause NMN aging reverse zone 2", "section_id": "sante"},
    {"theme": "Politique Canada", "query": "Canada Quebec politique gouvernement Legault Carney", "section_id": "politique"},
    {"theme": "Politique US", "query": "US politics Trump administration policy Congress", "section_id": "politique"},
    {"theme": "Politique International", "query": "geopolitics world news international Ukraine Taiwan EU", "section_id": "politique"},
    {"theme": "Business", "query": "marchés bourse économie Québec Canada business M&A", "section_id": "business"},
    {"theme": "Gouvernance AI", "query": "AI governance regulation EU AI Act Canada C-27 policy compliance ethics responsible AI", "section_id": "gouvernance"},
    {"theme": "Gouvernance AI Europe", "query": "AI Act EU artificial intelligence regulation GDPR compliance algorithmic accountability", "section_id": "gouvernance"},
    {"theme": "Cybersécurité", "query": "cybersecurity breach ransomware threat vulnerability CISO incident CVE exploit", "section_id": "cybersec"},
    {"theme": "Leadership", "query": "CTO engineering management culture team strategy executive leadership startup", "section_id": "leadership"},
    {"theme": "Futur du travail", "query": "future of work automation AI jobs workforce productivity remote hybrid transformation", "section_id": "futur-travail"},
    {"theme": "Futur du travail 2", "query": "AI productivity tools knowledge worker augmentation skills reskilling automation jobs", "section_id": "futur-travail"},
    {"theme": "Reddit AI", "query": "site:reddit.com/r/artificial OR site:reddit.com/r/MachineLearning OR site:reddit.com/r/LocalLLaMA AI LLM agent", "section_id": "ai-tech"},
    {"theme": "Reddit Cybersec", "query": "site:reddit.com/r/cybersecurity OR site:reddit.com/r/netsec breach vulnerability threat incident", "section_id": "cybersec"},
    {"theme": "Reddit Leadership", "query": "site:reddit.com/r/ExperiencedDevs OR site:reddit.com/r/cto OR site:reddit.com/r/engineering management leadership team culture", "section_id": "leadership"},
    {"theme": "Reddit Gouvernance AI", "query": "site:reddit.com/r/AIPolicy OR site:reddit.com/r/artificial AI regulation ethics policy governance", "section_id": "gouvernance"},
    {"theme": "Reddit Futur Travail", "query": "site:reddit.com/r/Futurology OR site:reddit.com/r/automate AI jobs automation future work productivity", "section_id": "futur-travail"}
  ],
  "sources_web": [
    "journaldequebec.com",
    "lesaffaires.com",
    "lapresse.ca",
    "radio-canada.ca",
    "ledevoir.com",
    "reuters.com",
    "apnews.com",
    "bloomberg.com",
    "hbr.org",
    "technologyreview.com",
    "wired.com",
    "theregister.com",
    "techcrunch.com",
    "venturebeat.com",
    "theverge.com",
    "arstechnica.com",
    "politico.eu",
    "iapp.org",
    "euractiv.com",
    "darkreading.com",
    "bleepingcomputer.com",
    "stratechery.com",
    "reddit.com"
  ],
  "sections": [
    {"id": "ai-tech",       "label": "AI / Tech",             "emoji": "🤖", "max_items": 4},
    {"id": "tesla",         "label": "Tesla",                 "emoji": "🚗", "max_items": 3},
    {"id": "spacex",        "label": "SpaceX",                "emoji": "🚀", "max_items": 3},
    {"id": "sante",         "label": "Santé",                 "emoji": "🏥", "max_items": 3},
    {"id": "politique",     "label": "Politique",             "emoji": "🏛️", "max_items": 4},
    {"id": "business",      "label": "Business",              "emoji": "💼", "max_items": 4},
    {"id": "gouvernance",   "label": "Gouvernance AI",        "emoji": "⚖️", "max_items": 3},
    {"id": "cybersec",      "label": "Cybersécurité",         "emoji": "🔐", "max_items": 3},
    {"id": "leadership",    "label": "Leadership / Gestion",  "emoji": "🧠", "max_items": 3},
    {"id": "futur-travail", "label": "Futur du travail",      "emoji": "🔮", "max_items": 3}
  ],
  "engagement_min": {
    "likes": 15,
    "reposts": 5
  },
  "max_items_per_author": 1
}
